{
  "id": 1227,
  "name": "Picture This",
  "author": "Mathfacts",
  "category": "game",
  "platform": "psp",
  "icon": "1227-picture-this.png",
  "description": "Homebrew game for PSP.",
  "requirements": "",
  "direct_url": "https://archive.org/download/picture.7z/picture.zip",
  "version": "1.0",
  "screenshots": [],
  "trophies": false,
  "ai": false,
  "trusted": false
}
