{
  "id": 1053,
  "name": "MegaMan The Power War",
  "author": "Nick Pizanias",
  "category": "game",
  "platform": "psp",
  "icon": "1053-megaman-the-power-war.png",
  "description": "OpenBOR mod for PSP.",
  "requirements": "",
  "direct_url": "https://archive.org/download/mmpw.-7z/MMPW.zip",
  "version": "1.0",
  "screenshots": [],
  "trophies": false,
  "ai": false,
  "trusted": false
}
