{
  "id": 1237,
  "name": "Pipeline",
  "author": "snowymydog",
  "category": "game",
  "platform": "psp",
  "icon": "1237-pipeline.png",
  "description": "Puzzle game for PSP.",
  "requirements": "",
  "direct_url": "https://archive.org/download/pipeline.-7z/Pipeline.zip",
  "version": "1.0",
  "screenshots": [],
  "trophies": false,
  "ai": false,
  "trusted": false
}
