{
  "id": 472,
  "name": "DJ Drops",
  "author": "Kern David (daaa)",
  "category": "game",
  "platform": "psp",
  "icon": "0472-dj-drops.png",
  "description": "Rhythm puzzle game for PSP.",
  "requirements": "",
  "direct_url": "https://archive.org/download/djdrops-demo-5-fixed.-7z/Old%20Versions/DJDropsDemo5_fixed.zip",
  "version": "1.0",
  "screenshots": [],
  "trophies": false,
  "ai": false,
  "trusted": false
}
