{
  "id": 2164,
  "name": "Zenonia 1 Remastered Vita",
  "author": "withLogic",
  "category": "port",
  "platform": "vita",
  "titleid": "ZNNA00002",
  "repo": "withLogic/zenonia1-remaster-vita",
  "asset": "*.vpk",
  "prerelease": false,
  "icon": "2164-zenonia-1-remastered-vita.png",
  "description": "ZENONIA 1 is a classic 2D action role-playing game. It follows the journey of a young hero named Regret as he investigates his adoptive father's murder, uncovers a deep conspiracy between rival factions of light and darkness, and fights against the demon god Ladon.",
  "requirements": "- libshacccg.suprx\n- kubridge.skprx\n- Game Data Files: Android",
  "screenshots": [],
  "trophies": false,
  "ai": true,
  "trusted": false
}
