{
  "id": 1559,
  "name": "Rubik's Cube",
  "author": "Quadrizo",
  "category": "game",
  "platform": "psp",
  "icon": "1559-rubik-s-cube.png",
  "description": "Rubik's cube for PSP.",
  "requirements": "",
  "direct_url": "https://archive.org/download/rubiks-quadrizo.-7z/Rubiks_quadrizo.zip",
  "version": "1.0",
  "screenshots": [],
  "trophies": false,
  "ai": false,
  "trusted": false
}
