{
  "id": 434,
  "name": "Darkyrinth",
  "author": "Nicovideo, Cloos",
  "category": "game",
  "platform": "psp",
  "icon": "0434-darkyrinth.png",
  "description": "Homebrew game for PSP.",
  "requirements": "",
  "direct_url": "https://archive.org/download/darkyrinth.-7z/Darkyrinth.zip",
  "version": "1.0",
  "screenshots": [],
  "trophies": false,
  "ai": false,
  "trusted": false
}
